DOI,Title,Authors,Journal,Year,Abstract,LitmapsId,Cited By,References,PubMedId,Tags
10.1145/3371276,MANDOLA: A Big-Data Processing and Visualization Platform for Monitoring and Detecting Online Hate Speech,"Demetris Paschalides, Dimosthenis Stephanidis, Andreas G. Andreou, Kalia Orphanou, G. Pallis, M. Dikaiakos, E. Markatos",ACM Trans. Internet Techn.,2020,"In recent years, the increasing propagation of hate speech in online social networks and the need for effective counter-measures have drawn significant investment from social network companies and researchers. This has resulted in the development of many web platforms and mobile applications for reporting and monitoring online hate speech incidents. In this article, we present MANDOLA, a big-data processing system that monitors, detects, visualizes, and reports the spread and penetration of online hate-related speech using big-data approaches. MANDOLA consists of six individual components that intercommunicate to consume, process, store, and visualize statistical information regarding hate speech spread online. We also present a novel ensemble-based classification algorithm for hate speech detection that can significantly improve the performance of MANDOLA’s ability to detect hate speech. To present the functionality and usability of our system, we present a use case scenario of real-life event annotation and data correlation. As shown from the performance of the individual modules, as well as the usability and functionality of the whole system, MANDOLA is a powerful system for reporting and monitoring online hate speech.",218752335,48,78,,"SUTD - Roy Lee Task 1 Part 1, SUTD - Roy Lee Task 1 Part 2, SUTD - Roy Lee Task 1 Part 3"
10.1109/mic.2020.3037034,HateClassify: A Service Framework for Hate Speech Identification on Social Media,"M. U. S. Khan, Assad Abbas, Attiqa Rehman, R. Nawaz",IEEE Internet Computing,2021,"It is indeed a challenge for the existing machine learning approaches to segregate the hateful content from the one that is merely offensive. One prevalent reason for low accuracy of hate detection with the current methodologies is that these techniques treat hate classification as a multiclass problem. In this article, we present the hate identification on the social media as a multilabel problem. To this end, we propose a CNN-based service framework called “HateClassify” for labeling the social media contents as the hate speech, offensive, or nonoffensive. Results demonstrate that the multiclass classification accuracy for the CNN-based approaches particularly sequential CNN (SCNN) is competitive and even higher than certain state-of-the-art classifiers. Moreover, in the multilabel classification problem, sufficiently high performance is exhibited by the SCNN among other CNN-based techniques. The results have shown that using multilabel classification instead of multiclass classification, hate speech detection is increased up to 20%.",167910864,40,19,,SUTD - Roy Lee Task 1 Part 1
10.1016/j.eswa.2023.121115,Improving hate speech detection using Cross-Lingual Learning,"Anderson Almeida Firmino, Cláudio de Souza Baptista, Anselmo Cardoso de Paiva",Expert systems with applications,2023,(missing abstract),264137968,37,10,,"SUTD - Roy Lee Task 1 Part 2, SUTD - Roy Lee Task 1 Part 3"
10.14569/ijacsa.2023.0140542,Hate Speech Detection in Social Networks using Machine Learning and Deep Learning Methods,"A. Toktarova, Dariga Syrlybay, B.B. Myrzakhmetova, G. Anuarbekova, Gulbarshin Rakhimbayeva, Balkiya Zhylanbaeva, Nabat Suieuova, Mukhtar Kerimbekov",International Journal of Advanced Computer Science and Applications,2023,"—Hate speech on social media platforms like Twitter is a growing concern that poses challenges to maintaining a healthy online environment and fostering constructive communication. Effective detection and monitoring of hate speech are crucial for mitigating its adverse impact on individuals and communities. In this paper, we propose a comprehensive approach for hate speech detection on Twitter using both traditional machine learning and deep learning techniques. Our research encompasses a thorough comparison of these techniques to determine their effectiveness in identifying hate speech on Twitter. We construct a robust dataset, gathered from diverse sources and annotated by experts, to ensure the reliability of our models. The dataset consists of tweets labeled as hate speech, offensive language, or neutral, providing a more nuanced representation of online discourse. We evaluate the performance of LSTM, BiLSTM, and CNN models against traditional shallow learning methods to establish a baseline for comparison. Our findings reveal that deep learning techniques outperform shallow learning methods, with BiLSTM emerging as the most accurate model for hate speech detection. The BiLSTM model demonstrates improved sensitivity to context, semantic nuances, and sequential patterns in tweets, making it adept at capturing the intricate nature of hate speech. Furthermore, we explore the integration of word embeddings, such as Word2Vec and GloVe, to enhance the performance of our models. The incorporation of these embeddings significantly improves the models' ability to discern between hate speech and other forms of online communication. This paper presents a comprehensive analysis of various machine learning methods for hate speech detection on Twitter, ultimately demonstrating the superiority of deep learning techniques, particularly BiLSTM, in addressing this critical issue. Our findings pave the way for further research into advanced methods of tackling hate speech and facilitating healthier online interactions.",262355943,36,48,,SUTD - Roy Lee Task 1 Part 1
10.3390/fi13030080,A Web Interface for Analyzing Hate Speech,"Lazaros Vrysis, N. Vryzas, Rigas Kotsakis, Theodora Saridou, María Matsiola, A. Veglis, Carlos Arcila Calderón, Charalampos A. Dimoulas",Future Internet,2021,"Social media services make it possible for an increasing number of people to express their opinion publicly. In this context, large amounts of hateful comments are published daily. The PHARM project aims at monitoring and modeling hate speech against refugees and migrants in Greece, Italy, and Spain. In this direction, a web interface for the creation and the query of a multi-source database containing hate speech-related content is implemented and evaluated. The selected sources include Twitter, YouTube, and Facebook comments and posts, as well as comments and articles from a selected list of websites. The interface allows users to search in the existing database, scrape social media using keywords, annotate records through a dedicated platform and contribute new content to the database. Furthermore, the functionality for hate speech detection and sentiment analysis of texts is provided, making use of novel methods and machine learning models. The interface can be accessed online with a graphical user interface compatible with modern internet browsers. For the evaluation of the interface, a multifactor questionnaire was formulated, targeting to record the users’ opinions about the web interface and the corresponding functionality.",222355136,32,70,,"SUTD - Roy Lee Task 1 Part 2, SUTD - Roy Lee Task 1 Part 3"
10.1016/j.compeleceng.2024.109153,Towards safer online communities: Deep learning and explainable AI for hate speech detection and classification,"Hareem Kibriya, A. Siddiqa, Wazir Zada Khan, Muhammad Khurram Khan",Computers & electrical engineering,2024,(missing abstract),273930073,31,12,,SUTD - Roy Lee Task 1 Part 1
10.3390/app11188575,Automatic Hate Speech Detection in English-Odia Code Mixed Social Media Data Using Machine Learning Techniques,"Sudhir Kumar Mohapatra, S. Prasad, D. K. Bebarta, T. K. Das, Kathiravan Srinivasan, Yuh-Chung Hu",Applied Sciences,2021,"Hate speech on social media may spread quickly through online users and subsequently, may even escalate into local vile violence and heinous crimes. This paper proposes a hate speech detection model by means of machine learning and text mining feature extraction techniques. In this study, the authors collected the hate speech of English-Odia code mixed data from a Facebook public page and manually organized them into three classes. In order to build binary and ternary datasets, the data are further converted into binary classes. The modeling of hate speech employs the combination of a machine learning algorithm and features extraction. Support vector machine (SVM), naïve Bayes (NB) and random forest (RF) models were trained using the whole dataset, with the extracted feature based on word unigram, bigram, trigram, combined n-grams, term frequency-inverse document frequency (TF-IDF), combined n-grams weighted by TF-IDF and word2vec for both the datasets. Using the two datasets, we developed two kinds of models with each feature—binary models and ternary models. The models based on SVM with word2vec achieved better performance than the NB and RF models for both the binary and ternary categories. The result reveals that the ternary models achieved less confusion between hate and non-hate speech than the binary models.",55438137,30,45,,SUTD - Roy Lee Task 1 Part 1
10.1109/aciiw.2019.8925079,Leveraging Hate Speech Detection to Investigate Immigration-related Phenomena in Italy,"Komal Florio, Valerio Basile, Mirko Lai, V. Patti",2019 8th International Conference on Affective Computing and Intelligent Interaction Workshops and Demos (ACIIW),2019,"The presence and integration of immigrants is one of the most controversial issues in our society, and given current worldwide political instabilities, it will likely become ever more prominent in the cultural and political debate. Social media play an increasingly important role in how citizens debate opinions and react to local and global events. However, several studies point out the danger of social media as a breeding ground for online hate speech (or cyberhate). We propose a novel approach to the exploratory analysis of social phenomena based on the integration of automatic detection of cyberhate against immigrants with offline indicators. We gathered data from the Italian Twittersphere and from the main supplier of official statistical data in Italy (ISTAT). We developed a supervised classification model for hate speech detection, trained on a corpus of Italian tweets manually annotated for hate speech against immigrants, and use it to automatically annotate a large sample of geo-tagged tweets over a span of six years. We crossed this data with the ISTAT data, exploring three macro-indicators related to employment, education and crime. We found correlations suggesting an interplay between economical and cultural factors and the expression of hate online.",39028821,29,26,,"SUTD - Roy Lee Task 1 Part 2, SUTD - Roy Lee Task 1 Part 3"
10.1145/3534678.3539161,Proactively Reducing the Hate Intensity of Online Posts via Hate Speech Normalization,"Sarah Masud, Manjot Bedi, Mohammad Aflah Khan, Md. Shad Akhtar, Tanmoy Chakraborty",Knowledge Discovery and Data Mining,2022,"Curbing online hate speech has become the need of the hour; however, a blanket ban on such activities is infeasible for several geopolitical and cultural reasons. To reduce the severity of the problem, in this paper, we introduce a novel task, hate speech normalization, that aims to weaken the intensity of hatred exhibited by an online post. The intention of hate speech normalization is not to support hate but instead to provide the users with a stepping stone towards non-hate while giving online platforms more time to monitor any improvement in the user's behavior. To this end, we manually curated a parallel corpus - hate texts and their normalized counterparts (a normalized text is less hateful and more benign). We introduce NACL, a simple yet efficient hate speech normalization model that operates in three stages - first, it measures the hate intensity of the original sample; second, it identifies the hate span(s) within it; and finally, it reduces hate intensity by paraphrasing the hate spans. We perform extensive experiments to measure the efficacy of NACL via three-way evaluation (intrinsic, extrinsic, and human-study). We observe that NACL outperforms six baselines - NACL yields a score of 0.1365 RMSE for the intensity prediction, 0.622 F1-score in the span identification, and 82.27 BLEU and 80.05 perplexity for the normalized text generation. We further show the generalizability of NACL across other platforms (Reddit, Facebook, Gab). An interactive prototype of NACL was put together for the user study. Further, the tool is being deployed in a real-world setting at Wipro AI as a part of its mission to tackle harmful content on online platforms.",238850537,28,47,,SUTD - Roy Lee Task 1 Part 1
10.1109/access.2024.3367281,Enhancing Hate Speech Detection in the Digital Age: A Novel Model Fusion Approach Leveraging a Comprehensive Dataset,"Waqas Sharif, Saima Abdullah, Saman Iftikhar, Daniah Al-Madani, Shahzad Mumtaz",IEEE Access,2024,"In the era of digital communication, social media platforms have experienced exponential growth, becoming primary channels for information exchange. However, this surge has also amplified the rapid spread of hate speech, prompting extensive research efforts for effective mitigation. These efforts have prominently featured advanced natural language processing techniques, particularly emphasizing deep learning methods that have shown promising outcomes. This article presents a novel approach to address this pressing issue, combining a comprehensive dataset of 18 sources. It includes 0.45 million comments sourced from various digital platforms spanning different time frames. There were two models utilized to address the diversity in the data and leverage distinct strengths found within deep learning frameworks: CNN and BiLSTM with an attention mechanism. These models were tailored to handle specific subsets of the data, allowing for a more targeted approach. The unique outputs from both models were then fused into a unified model. This methodology outperformed recent models, showcasing enhanced generalization capabilities even when tested on the largest and most diverse dataset. Our model achieved an impressive accuracy of 89%, while maintaining a high precision of 0.88 and recall of 0.91.",269967534,27,58,,SUTD - Roy Lee Task 1 Part 1
10.1007/s42001-024-00248-9,A survey of explainable AI techniques for detection of fake news and hate speech on social media platforms,"Vaishali U. Gongane, M. Munot, A. Anuse",Journal of Computational Social Science,2024,(missing abstract),270303385,26,64,,SUTD - Roy Lee Task 1 Part 1
10.1108/dta-01-2019-0007,Combating the challenges of social media hate speech in a polarized society: A Twitter ego lexalytics approach,"Collins N. Udanor, Chinatu C. Anyanwu",Drug Testing and Analysis,2019,"Hate speech in recent times has become a troubling development. It has different meanings to different people in different cultures. The anonymity and ubiquity of the social media provides a breeding ground for hate speech and makes combating it seems like a lost battle. However, what may constitute a hate speech in a cultural or religious neutral society may not be perceived as such in a polarized multi-cultural and multi-religious society like Nigeria. Defining hate speech, therefore, may be contextual. Hate speech in Nigeria may be perceived along ethnic, religious and political boundaries. The purpose of this paper is to check for the presence of hate speech in social media platforms like Twitter, and to what degree is hate speech permissible, if available? It also intends to find out what monitoring mechanisms the social media platforms like Facebook and Twitter have put in place to combat hate speech. Lexalytics is a term coined by the authors from the words lexical analytics for the purpose of opinion mining unstructured texts like tweets.,This research developed a Python software called polarized opinions sentiment analyzer (POSA), adopting an ego social network analytics technique in which an individual’s behavior is mined and described. POSA uses a customized Python N-Gram dictionary of local context-based terms that may be considered as hate terms. It then applied the Twitter API to stream tweets from popular and trending Nigerian Twitter handles in politics, ethnicity, religion, social activism, racism, etc., and filtered the tweets against the custom dictionary using unsupervised classification of the texts as either positive or negative sentiments. The outcome is visualized using tables, pie charts and word clouds. A similar implementation was also carried out using R-Studio codes and both results are compared and a t-test was applied to determine if there was a significant difference in the results. The research methodology can be classified as both qualitative and quantitative. Qualitative in terms of data classification, and quantitative in terms of being able to identify the results as either negative or positive from the computation of text to vector.,The findings from two sets of experiments on POSA and R are as follows: in the first experiment, the POSA software found that the Twitter handles analyzed contained between 33 and 55 percent hate contents, while the R results show hate contents ranging from 38 to 62 percent. Performing a t-test on both positive and negative scores for both POSA and R-studio, results reveal p-values of 0.389 and 0.289, respectively, on an α value of 0.05, implying that there is no significant difference in the results from POSA and R. During the second experiment performed on 11 local handles with 1,207 tweets, the authors deduce as follows: that the percentage of hate contents classified by POSA is 40 percent, while the percentage of hate contents classified by R is 51 percent. That the accuracy of hate speech classification predicted by POSA is 87 percent, while free speech is 86 percent. And the accuracy of hate speech classification predicted by R is 65 percent, while free speech is 74 percent. This study reveals that neither Twitter nor Facebook has an automated monitoring system for hate speech, and no benchmark is set to decide the level of hate contents allowed in a text. The monitoring is rather done by humans whose assessment is usually subjective and sometimes inconsistent.,This study establishes the fact that hate speech is on the increase on social media. It also shows that hate mongers can actually be pinned down, with the contents of their messages. The POSA system can be used as a plug-in by Twitter to detect and stop hate speech on its platform. The study was limited to public Twitter handles only. N-grams are effective features for word-sense disambiguation, but when using N-grams, the feature vector could take on enormous proportions and in turn increasing sparsity of the feature vectors.,The findings of this study show that if urgent measures are not taken to combat hate speech there could be dare consequences, especially in highly polarized societies that are always heated up along religious and ethnic sentiments. On daily basis tempers are flaring in the social media over comments made by participants. This study has also demonstrated that it is possible to implement a technology that can track and terminate hate speech in a micro-blog like Twitter. This can also be extended to other social media platforms.,This study will help to promote a more positive society, ensuring the social media is positively utilized to the benefit of mankind.,The findings can be used by social media companies to monitor user behaviors, and pin hate crimes to specific persons. Governments and law enforcement bodies can also use the POSA application to track down hate peddlers.",68518494,25,69,,SUTD - Roy Lee Task 1 Part 1
(missing DOI),"Computational Linguistics Against Hate: Hate Speech Detection and Visualization on Social Media in the ""Contro L'Odio"" Project","A. Capozzi, Mirko Lai, Valerio Basile, C. Musto, Marco Polignano, Fabio Poletto, M. Sanguinetti, C. Bosco, V. Patti, G. Ruffo, G. Semeraro, M. Stranisci",CLiC-it,2019,"The paper describes the Web platform built within the project “Contro l’odio”, for monitoring and contrasting discrimination and hate speech against immigrants in Italy. It applies a combination of computational linguistics techniques for hate speech detection and data visualization tools on data drawn from Twitter. It allows users to access a huge amount of information through interactive maps, also tuning their view, e.g., visualizing the most viral tweets and interactively reducing the inherent complexity of data. Educational courses for high school students and citizenship has been developed which are centered on the platform and focused on the deconstruction of negative stereotypes against immigrants, Roma, and religious minorities, and on the creation of positive narratives.",235445883,23,15,,"SUTD - Roy Lee Task 1 Part 2, SUTD - Roy Lee Task 1 Part 3"
10.1007/s10796-023-10446-x,Comparing Machine Learning and Deep Learning Techniques for Text Analytics: Detecting the Severity of Hate Comments Online,"Alaa Marshan, Farah Nasreen Mohamed Nizar, Athina Ioannou, Stella Despoudi",Information Systems Frontiers,2023,"Abstract Social media platforms have become an increasingly popular tool for individuals to share their thoughts and opinions with other people. However, very often people tend to misuse social media posting abusive comments. Abusive and harassing behaviours can have adverse effects on people's lives. This study takes a novel approach to combat harassment in online platforms by detecting the severity of abusive comments, that has not been investigated before. The study compares the performance of machine learning models such as Naïve Bayes, Random Forest, and Support Vector Machine, with deep learning models such as Convolutional Neural Network (CNN) and Bi-directional Long Short-Term Memory (Bi-LSTM). Moreover, in this work we investigate the effect of text pre-processing on the performance of the machine and deep learning models, the feature set for the abusive comments was made using unigrams and bigrams for the machine learning models and word embeddings for the deep learning models. The comparison of the models’ performances showed that the Random Forest with bigrams achieved the best overall performance with an accuracy of (0.94), a precision of (0.91), a recall of (0.94), and an F1 score of (0.92). The study develops an efficient model to detect severity of abusive language in online platforms, offering important implications both to theory and practice.",266381241,20,87,,SUTD - Roy Lee Task 1 Part 1
(missing DOI),Countering Online Hate Speech: An NLP Perspective,"Mudit Chaudhary, Chandni Saxena, Helen Meng",arXiv: Computation and Language,2021,"Online hate speech has caught everyone's attention from the news related to the COVID-19 pandemic, US elections, and worldwide protests. Online toxicity - an umbrella term for online hateful behavior, manifests itself in forms such as online hate speech. Hate speech is a deliberate attack directed towards an individual or a group motivated by the targeted entity's identity or opinions. The rising mass communication through social media further exacerbates the harmful consequences of online hate speech. While there has been significant research on hate-speech identification using Natural Language Processing (NLP), the work on utilizing NLP for prevention and intervention of online hate speech lacks relatively. This paper presents a holistic conceptual framework on hate-speech NLP countering methods along with a thorough survey on the current progress of NLP for countering online hate speech. It classifies the countering techniques based on their time of action, and identifies potential future research areas on this topic.",25780920,20,68,,SUTD - Roy Lee Task 1 Part 1
(missing DOI),Enhancing Multilingual Hate Speech Detection: From Language-Specific Insights to Cross-Linguistic Integration,"Ehtesham Hashmi, Sule Yildirim Yayilgan, Ibrahim A. Hameed, Muhammad Mudassar Yamin, Mohib Ullah, Mohamed Abomhara",IEEE Access,2024,(missing abstract),277272434,16,0,,"SUTD - Roy Lee Task 1 Part 2, SUTD - Roy Lee Task 1 Part 3"
(missing DOI),Tools and Resources for Detecting Hate and Prejudice against Immigrants in Social Media,"C. Bosco, V. Patti, Marcello Bogetti, M. Conoscenti, G. Ruffo, R. Schifanella, M. Stranisci",(missing journal),2017,". This position paper describes the early stages of an on going project for the development of artiﬁcial intelligence tools and resourcestodetect andanalyzehatespeechandprejudiceagainst immigrants: IHATEPREJUDICE 3 . It istheresult of amulti-disciplinary team that includes skills from computational linguistics and sentiment analysis, to social network analysisand visualization. Theapproach followsaholistic and multi-lingual perspective, which encompassesdifferent knowledgesourcesto bemeaningfully aggregated. Thus, although the project is currently mainly focussed on a local case-study (Piedmont, a region of Italy), it is scalable over larger territories and different languages which can be considered as representative, namely the European Union. Since this is quite an innovative approach to the problem, this position paper aims at reaching out colleagues with a potential interest in this area and/or to solicitate feedback by those who are in the early stages of their projectsand wish to sharetheir experienceor join efforts.",153331946,15,17,,"SUTD - Roy Lee Task 1 Part 2, SUTD - Roy Lee Task 1 Part 3"
