DOI,Title,Authors,Journal,Year,Abstract,LitmapsId,Cited By,References,PubMedId,Tags
10.1109/csci54926.2021.00180,A new SOCMINT framework for Threat Intelligence Identification,"Marco San Biagio, R. Acquaviva, Valentina Mazzonello, Ernesto La Mattina, V. Morreale",2021 International Conference on Computational Science and Computational Intelligence (CSCI),2021,"Social Media platforms have changed the way of communication between people. These platforms allow users and organizations to communicate with each other, sharing their ideas, interests, and knowledge, becoming a part of their daily routine. On the other hand, social media platforms represent good channels to exploit for perpetrating various kinds of crimes and crimes illegal activities in several criminal areas, including cyber-crimes and terrorism. The goal of this work is to present a novel framework for Threat Intelligence that adopts Machine Learning and Artificial Intelligence techniques for OSINT (Open–source intelligence) investigation can extract actionable intelligence for threats.",230543813,3,22,,"SUTD - Roy Lee Task 1 Part 2, SUTD - Roy Lee Task 1 Part 3"
10.5121/csit.2022.121516,A Transformer based Multi-Task Learning Approach Leveraging Translated and Transliterated Data to Hate Speech Detection in Hindi,"Prashant Kapil, Asif Ekbal",Data Science and Machine Learning,2022,"The increase in usage of the internet has also led to an increase in unsocial activities, hate speech is one of them. The increase in Hate speech over a few years has been one of the biggest problems and automated techniques need to be developed to detect it. This paper aims to use the eight publicly available Hindi datasets and explore different deep neural network techniques to detect aggression, hate, abuse, etc. We experimented on multilingual-bidirectional encoder representations from the transformer (M-BERT) and multilingual representations for Indian languages (MuRIL) in four settings (i) Single task learning (STL) framework. (ii) Transfering the encoder knowledge to the recurrent neural network (RNN). (iii) Multi-task learning (MTL) where eight Hindi datasets were jointly trained and (iv) pre-training the encoder with translated English tweets to Devanagari script and the same Devanagari scripts transliterated to romanized Hindi tweets and then fine-tuning it in MTL fashion. Experimental evaluation shows that cross-lingual information in MTL helps in improving the performance of all the datasets by a significant margin, hence outperforming the state-of-the-art approaches in terms of weightedF1 score. Qualitative and quantitative error analysis is also done to show the effects of the proposed approach.",249886906,3,53,,SUTD - Roy Lee Task 1 Part 1
10.5220/0013070000003825,Hate Speech Detection Using Cross-Platform Social Media Data in English and German Language,"Gautam Kishore Shahi, Tim A. Majchrzak",(missing journal),2024,(missing abstract),281531123,3,0,,SUTD - Roy Lee Task 1 Part 1
(missing DOI),Exploring Intensities of Hate Speech on Social Media: A Case Study on Explaining Multilingual Models with XAI,"Raisa Romanov Geleta, Klaus Eckelt, Emilia Parada-Cabaleiro, Markus Schedl","International Conference on Language, Data, and Knowledge",2023,(missing abstract),271163311,2,0,,"SUTD - Roy Lee Task 1 Part 2, SUTD - Roy Lee Task 1 Part 3"
10.1109/eurospw.2019.00035,Towards Fully Integrated Real-time Detection Framework for Online Contents Analysis - RED-Alert Approach,"Syed Naqvi, Ian Williams, Sean Enderby, Péter Pollner, Daniel Abel, Berta Biescas, Oscar Garcia, Monica Florea, Cristi Potlog",(missing journal),2019,"Social media is extensively used nowadays and is gaining popularity among the users with the increasing growth in the network capacity, connectivity, and speed. Moreover, affordable prices of data plans, especially mobile data packages, have considerably increased the use of multimedia by different users. This includes terrorists who use social media platforms to promote their ideology and intimidate their adversaries. It is therefore very important to develop automated solutions to semantically analyse online contents to assist law enforcement agencies in the preventive policing of online activities. A major challenge for the social media forensic analysis is to preserve the privacy of citizens who use online social networking platforms. This paper presents results of European H2020 project RED-Alert that aims to enable secure and privacy preserving data processing; hence the malicious content and the corresponding personality can be ethically tracked. We have mined seven social media channels for content and providing support for ten languages for analysis. Our proposed solution is designed to ensure security and policing of online contents by detecting terrorist material. We have used social network analysis, speech recognition, face and object detection besides audio event detection to extract information from online sources that are fed in a complex event processor. We have discussed the challenges and prospects of this work especially the need of analysing online contents while respecting European and national data protection laws notably GDPR.",188317005,2,8,,"SUTD - Roy Lee Task 1 Part 2, SUTD - Roy Lee Task 1 Part 3"
10.1109/acdsa59508.2024.10467738,MARPLE: A Framework for Social Media Threat Intelligence,"Marco San Biagio, Simone Simoncini, Ernesto La Mattina, V. Morreale","2024 International Conference on Artificial Intelligence, Computer, Data Sciences and Applications (ACDSA)",2024,"In last years, the use of social media platforms by terrorist organizations have become more evident. Since the emergence of digital communication, extremist groups have had unheard-of possibilities to spread their beliefs, enlist new members, and plan pervasive radicalization campaigns. Terrorist organizations utilize social media to span their messages, taking advantage of its wide audience, anonymity, and instantaneous connectivity. For this reason, Social Media Intelligence (SOCMINT) is becoming an effective mean to support LEAs in monitoring of social media, blogs, and forums to identify any suspicious content and potential terrorist threat. The goal of this work is to propose an AI-based Threat Intelligence tool that applies Deep Learning techniques for OSINT (Open-Source Intelligence) investigation, supporting intelligence analysts and investigators to timely identify terrorist threats from social networks. Results obtained on a newly created dataset confirm the efficiency and effectiveness of the proposed tool in the identification of malicious posts related to terrorist activities.",270704370,2,30,,"SUTD - Roy Lee Task 1 Part 2, SUTD - Roy Lee Task 1 Part 3"
10.48084/etasr.13249,Cross-Platform Hate Speech Detection Using an Attention-Enhanced BiLSTM Model,"Muzammil Hussain, Waqas Sharif, M. Faheem, Yazeed Alsarhan, Hany A. Elsalamony","Engineering, Technology &amp; Applied Science Research",2025,"Hate speech is rapidly spreading across digital platforms, appearing in diverse forms driven by regional, cultural, and linguistic differences. This growing trend presents serious challenges to social harmony and online safety. Existing hate speech detection models often fall short because they rely on limited and homogeneous datasets, making them less effective in real-world, culturally diverse settings. Handling large-scale, diverse datasets adds notable complexity to capturing contextual nuances, as different populations and cultures demonstrate unique language patterns and expressions. This study addresses the necessity for a more universal solution by proposing a deep learning model trained on an extensive and diverse dataset comprising 842,000 samples collected from various digital platforms. The approach combines a Bidirectional Long Short-Term Memory (BiLSTM) model with a self-attention mechanism to capture contextual depth. Various data embedding techniques were used to assess their impact, along with data resampling and standard Natural Language Processing (NLP) pre-processing steps. The proposed model achieved 93% accuracy with an F1-score of 0.92, outperforming several baseline and state-of-the-art models. This work provides a comprehensive and scalable framework for the detection of hate speech across various online platforms.",297799049,2,41,,SUTD - Roy Lee Task 1 Part 1
10.3390/computers14070279,A Large Language Model-Based Approach for Multilingual Hate Speech Detection on Social Media,"Muhammad Usman, Muhammad Ahmad, Grigori Sidorov, Irina Gelbukh, Rolando Quintero",Computers,2025,"The proliferation of hate speech on social media platforms poses significant threats to digital safety, social cohesion, and freedom of expression. Detecting such content—especially across diverse languages—remains a challenging task due to linguistic complexity, cultural context, and resource limitations. To address these challenges, this study introduces a comprehensive approach for multilingual hate speech detection. To facilitate robust hate speech detection across diverse languages, this study makes several key contributions. First, we created a novel trilingual hate speech dataset consisting of 10,193 manually annotated tweets in English, Spanish, and Urdu. Second, we applied two innovative techniques—joint multilingual and translation-based approaches—for cross-lingual hate speech detection that have not been previously explored for these languages. Third, we developed detailed hate speech annotation guidelines tailored specifically to all three languages to ensure consistent and high-quality labeling. Finally, we conducted 41 experiments employing machine learning models with TF–IDF features, deep learning models utilizing FastText and GloVe embeddings, and transformer-based models leveraging advanced contextual embeddings to comprehensively evaluate our approach. Additionally, we employed a large language model with advanced contextual embeddings to identify the best solution for the hate speech detection task. The experimental results showed that our GPT-3.5-turbo model significantly outperforms strong baselines, achieving up to an 8% improvement over XLM-R in Urdu hate speech detection and an average gain of 4% across all three languages. This research not only contributes a high-quality multilingual dataset but also offers a scalable and inclusive framework for hate speech detection in underrepresented languages.",288840772,2,30,,"SUTD - Roy Lee Task 1 Part 2, SUTD - Roy Lee Task 1 Part 3"
10.5282/ubm/epub.76087,"Artificial Intelligence, Extreme Speech and the Challenges of Online Content Moderation","Sahana Udupa, Elonnai Hickok, Antonis Maronikolakis, Hinrich Schuetze, Laura Csuka, Axel Wisiorek, Leah Nann",(missing journal),2021,(missing abstract),261362217,2,0,,SUTD - Roy Lee Task 1 Part 1
10.1109/inocon60754.2024.10511522,Understanding the Evolution of Abusive Behaviour in Online Social Networks,"Ovais Bashir Gashroo, Monica Mehrotra",2024 3rd International Conference for Innovation in Technology (INOCON),2024,"This paper presents a comprehensive investigation into the intricate dynamics of abusive behaviour in online social networks, utilizing cutting-edge methodologies at the intersection of computer science, natural language processing (NLP), and social network analysis. Cross-platform and cultural variances are rigorously examined, addressing challenges posed by platform-specific features and linguistic nuances. Innovative approaches including transfer learning, adversarial training, and multimodal analysis showcase the adaptability of models to diverse online environments. The technical depth of the paper is evident in the exploration of NLP advancements, leveraging state-of-the-art models such as BERT and GPT-3 for a nuanced understanding of abusive language. Machine learning models, including ensemble approaches and deep learning architectures like CNNs and RNNs, are harnessed for precise classification tasks. Social network analysis metrics uncover patterns of influence and community dynamics contributing to abusive behaviour. The research navigates ethical considerations with finesse, addressing issues of privacy, algorithmic fairness, and bias mitigation. The cross-cultural and cross-platform analyses are underpinned by carefully curated datasets that encapsulate the diverse nature of online interactions, ensuring the robustness and generalizability of the proposed methodologies. In conclusion, this paper not only contributes to the evolving landscape of abusive behaviour research but also establishes a benchmark for interdisciplinary studies. The technical acumen demonstrated in the methodologies, coupled with a commitment to ethical practices, positions this research at the forefront of endeavours to comprehend, predict, and mitigate abusive behaviour in the dynamic realm of online social networks.",272053700,1,34,,SUTD - Roy Lee Task 1 Part 1
10.1117/12.2306712,The event tracking dashboard: from multilingual social media feeds to event patterns and anomalies,"P. Giridhar, Jongdeog Lee, T. Abdelzaher, Lance M. Kaplan",Defense + Security,2018,"The proliferation of real-time information on social media opens up unprecedented opportunities for situation awareness that arise from extracting unfolding physical events from their social media footprints. The paper describes experiences with a new social media analysis toolkit for detecting and tracking such physical events. A key advantage of the explored analysis algorithms is that they require no prior training, and as such can operate out-of-the-box on new languages, dialects, jargon, and application domains (where by ""new"", we mean new to the machine), including detection of protests, natural disasters, acts of terror, accidents, and other disruptions. By running the toolkit over a period of time, patterns and anomalies are also detected that offer additional insights and understanding. Through analysis of contemporary political, military, and natural disaster events, the work explores the limits of the training-free approach and demonstrates promise and applicability.",211032537,1,6,,"SUTD - Roy Lee Task 1 Part 2, SUTD - Roy Lee Task 1 Part 3"
10.1109/delcon64804.2024.10867230,Proposed Framework for Detecting Multilingual Hate Speech on Social Media Platform,"Rachna Narula, Poonam Chaudhary",2024 3rd Edition of IEEE Delhi Section Flagship Conference (DELCON),2024,"This research introduces a smart system that can find hurtful words in many different languages on the internet. It uses special computer programs that help it understand how different languages work, so it can spot hate speech correctly. These programs, like BERT and GPT, help the system learn and improve. The way the system is built allows it to quickly work in real-time, which means it can help keep online spaces safe and friendly while easily adding new languages or adjusting to new ways people talk online. This system is really helpful for keeping social media nice and supportive by checking for bad words in posts, like those on Twitter, and training to get better at it.",284128561,0,20,,"SUTD - Roy Lee Task 1 Part 2, SUTD - Roy Lee Task 1 Part 3"
10.1109/aespc63931.2024.10872383,Real-Time Hate Speech Recognition Along with Educational Feedback and Automatic Reporting,"Abhilasha Panda, Abhijeet Anand, Sujit Bebortta, Subhranshu Sekhar Tripathy, Tanmay Mukherjee","2024 IEEE 4th International Conference on Applied Electromagnetics, Signal Processing, & Communication (AESPC)",2024,"In today's digital era, the rise of toxicity, discrimination, and harm on online communication platforms has become a significant concern, necessitating effective moderation strategies. Existing methods for hate speech detection often lack real-time capabilities and fail to provide constructive feedback to users. Natural Language Processing (NLP) is used to identify the intent of the speech and bidirectional Long Short Term Memory (LSTM) machine learning algorithm classifies text into multiple hate speech categories. The designed system also displays charts, providing a detailed assessment and understanding of the nature and severity of the content. With a user-friendly interface, users receive real-time educational feedback on the nature and impact of different types of hate speech, promoting awareness and discouraging toxic behavior.",284101455,0,11,,SUTD - Roy Lee Task 1 Part 1
10.3390/electronics15020442,Cross-Platform Multi-Modal Transfer Learning Framework for Cyberbullying Detection,"Weiqi Zhang, Chengzu Dong, Aiting Yao, A. Nazari, Anuroop Gaddam",Electronics,2026,"Cyberbullying and hate speech increasingly appear in multi-modal social media posts, where images and text are combined in diverse and fast changing ways across platforms. These posts differ in style, vocabulary and layout, and labeled data are sparse and noisy, which makes it difficult to train detectors that are both reliable and deployable under tight computational budgets. Many high performing systems rely on large vision language backbones, full parameter fine tuning, online retrieval or model ensembles, which raises training and inference costs. We present a parameter efficient cross-platform multi-modal transfer learning framework for cyberbullying and hateful content detection. Our framework has three components. First, we perform domain adaptive pretraining of a compact ViLT backbone on in domain image-text corpora. Second, we apply parameter efficient fine tuning that updates only bias terms, a small subset of LayerNorm parameters and the classification head, leaving the inference computation graph unchanged. Third, we use noise aware knowledge distillation from a stronger teacher built from pretrained text and CLIP based image-text encoders, where only high confidence, temperature scaled predictions are used as soft labels during training, and teacher models and any retrieval components are used only offline. We evaluate primarily on Hateful Memes and use IMDB as an auxiliary text only benchmark to show that the deployment aware PEFT + offline-KD recipe can still be applied when other modalities are unavailable. On Hateful Memes, our student updates only 0.11% of parameters and retain about 96% of the AUROC of full fine-tuning.",298403405,0,16,,SUTD - Roy Lee Task 1 Part 1
10.1145/3748492,Advancements in Transformer-Based Models for Enhanced Hate Speech Detection in Arabic: Addressing Dialectal Variations and Cross-Platform Challenges,"Ahmed Fat’hAlalim, Yongjian Liu, Qing Xie, Nahla Ibrahim",ACM Transactions on Asian and Low-Resource Language Information Processing,2025,"The rise of social media platforms has greatly amplified the spread of hate speech, which poses serious societal risks. The automated detection of hate speech on social media, especially in low-resource Arabic language, presents unique challenges owing to linguistic diversity, dialectal differences, and regional nuances. However, most current research efforts primarily focus on a single social media platform, which hinders the ability to address dialect differences, as residents of Arab regions often favor one platform over another. This study provides an in-depth analysis of Arabic hate speech detection using advanced transformer-based models across three datasets collected from diverse social media platforms. Our models include multilingual, monolingual models pretrained in Arabic, and models that employ transfer learning from rich-resource English. To provide a thorough evaluation, we also compared the performance of our transformer-based models with two baseline models: LR and NBSVM, highlighting their relative effectiveness in detecting hate speech across multi-dialect and multi-platforms. Our analysis includes the effects of oversampling, data augmentation, and model interpretability using the LIME method. The monolingual transformer-based models, in particular, demonstrated significant performance improvements, setting new benchmarks for F1-scores and surpassing traditional models, our best classifier achieved an F1-score of 98.82%. Additionally, we conducted thorough cross-validation across datasets to evaluate the models’ generalization capabilities. Our research significantly advances Arabic hate speech detection by tackling these complexities and laying a solid foundation for future research. However, challenges remain in detecting subtle forms of hate speech, such as implicit hate speech and fine-grained distinctions between offensive content.",288944040,0,59,,SUTD - Roy Lee Task 1 Part 1
10.1109/ubmk67458.2025.11207036,Review of Multilingual Social Media Hate Speech Identification and Mitigation,"A. Zhidebayeva, Gulnar Madaliyeva, N.F. Sarsenbiyeva, Toktarova Aigerim, Zhanar Kemelbekova, Bayan Tastanbekova",2025 10th International Conference on Computer Science and Engineering (UBMK),2025,"This work focuses on the proliferation of hate speech among children and adolescents, emphasizing the creation of a particular methodological framework to combat this issue within the Kazakhstani section of social networks. The study incorporates findings from international research undertaken in the USA, Great Britain, and various European nations, employing a complete methodology that encompasses theoretical analysis, synthesis, empirical comparison, and aspects of experimental techniques. Special emphasis is placed on the application of technical solutions for the identification and prevention of hate speech. The research investigates the development of a parser and the methodical accumulation of data required for training machine and deep learning algorithms to detect offensive and toxic remarks in real time. The developed solutions are designed to enhance the efficiency of automatic moderation on online platforms and safeguard vulnerable user groups. The study targets both novices and seasoned professionals in data analysis, highlighting the necessity for enhanced practical research in the utilization of deep learning algorithms. Future plans include the development of the proposed methodologies and the publication of articles focused on a comprehensive examination and optimization of intellectual models to combat the proliferation of hate speech.",291912991,0,18,,"SUTD - Roy Lee Task 1 Part 2, SUTD - Roy Lee Task 1 Part 3"
10.1109/icimia67127.2025.11200817,Cross-Platform Hate Speech Propagation Analysis using Machine Learning,"K. R, Megalan A, Selvarathinam S, Pragadheesh P",International Conference on Innovative Mechanisms for Industry Applications,2025,"The study begins by web scraping diverse datasets from various social platforms. The collected text data consists of posts, comments, and threads from engaged and polarized discussion platforms. Social media text is loud and unstructured, and several preprocessing techniques are used to clean and normalize it. The preprocessing method is based on the Term Frequency-Inverse Document Frequency (TF-IDF). Recursive Feature Elimination (RFE) is used, gradually reducing the feature set to the most crucial ones for identifying hate speech by iteratively training a model. The classification phase utilizes Bidirectional Long-Short Term Memory (BiLSTM) networks to detect hate speech in text by capturing contextual dependencies in both forward and backward directions. The model's performance was assessed using conventional classification metrics, including accuracy (94.1%). Platform-specific metrics are also computed to analyze differences in linguistic structures and user behavior on social platforms. Cross-validation and stratified sampling are employed to ensure a balanced assessment across various subsets of data.",292213520,0,17,,SUTD - Roy Lee Task 1 Part 1
10.1109/access.2025.3629527,MUST: An explainable AI–based framework for MUltilingual hate Speech deTection,"Ijaz Hussain, Muhammad Afzal Rizvi, Zain Abbas, Ammara Nawaz Cheema, Ibrahim M. Almanjahie",IEEE Access,2025,(missing abstract),292802279,0,0,,SUTD - Roy Lee Task 1 Part 1
10.1109/icscan58655.2023.10395354,Ensemble Text Classification with TF-IDF Vectorization for Hate Speech Detection in Social Media,"S. R, Karthikeyan T, Praveen kumar P, Shamsundar S M","2023 International Conference on System, Computation, Automation and Networking (ICSCAN)",2023,"The development of artificial intelligence (AI) has changed how hate speech is detected. In hate speech identification using machine learning, a number of methods are used to automatically find text that uses vocabulary that is considered to be derogatory, discriminatory, or motivated by hatred. Supervised learning techniques like neural networks, decision trees, and SVMs need a labelled dataset comprising samples of hate speech and non-hate speech. This project investigates the use of AI and machine learning techniques to automatically detect material that uses offensive, intolerant, or hostile words. A voting classifier and TF-IDF representations are combined to improve classification accuracy. The ensemble of classifiers, powered by AI approaches, shows impressive accuracy in identifying hate speech by training five different classifiers (Random Forest, Bagging, Support Vector Machine, AdaBoost, and Gradient Boosting) on a labelled dataset of tweets. The TF-IDF representation prioritises textual terms, whereas the ensemble method uses classifier diversity to capture distinctive patterns. Results from experiments show the strategy's effectiveness, with precision 0.95, recall 0.96, f1-score 0.95 and accuracy 0.97 for detecting hate speech. By successfully utilising AI's capacity to fight hate speech, this research helps the development of a diverse and secure online environment. The suggested approach works well for automatically identifying hate speech, making the internet a safer and more welcoming place for all users.",268830318,0,21,,SUTD - Roy Lee Task 1 Part 1
