DOI,Title,Authors,Journal,Year,Abstract,LitmapsId,Cited By,References,PubMedId,Tags
10.1145/3041021.3054223,Deep Learning for Hate Speech Detection in Tweets,"Pinkesh Badjatiya, Shashank Gupta, Manish Gupta, Vasudeva Varma",arXiv: Computation and Language,2017,"Hate speech detection on Twitter is critical for applications like controversial event extraction, building AI chatterbots, content recommendation, and sentiment analysis. We define this task as being able to classify a tweet as racist, sexist or neither. The complexity of the natural language constructs makes this task very challenging. We perform extensive experiments with multiple deep learning architectures to learn semantic word embeddings to handle this complexity. Our experiments on a benchmark dataset of 16K annotated tweets show that such deep learning methods outperform state-of-the-art char/word n-gram methods by ~18 F1 points.",65864534,1326,7,,SUTD - Roy Lee Task 1 Part 1
10.3390/s19214654,Detecting and Monitoring Hate Speech in Twitter,"Juan Carlos Pereira-Kohatsu, L. Sánchez, F. Liberatore, M. Camacho-Collados",Sensors,2019,"Social Media are sensors in the real world that can be used to measure the pulse of societies. However, the massive and unfiltered feed of messages posted in social media is a phenomenon that nowadays raises social alarms, especially when these messages contain hate speech targeted to a specific individual or group. In this context, governments and non-governmental organizations (NGOs) are concerned about the possible negative impact that these messages can have on individuals or on the society. In this paper, we present HaterNet, an intelligent system currently being used by the Spanish National Office Against Hate Crimes of the Spanish State Secretariat for Security that identifies and monitors the evolution of hate speech in Twitter. The contributions of this research are many-fold: (1) It introduces the first intelligent system that monitors and visualizes, using social network analysis techniques, hate speech in Social Media. (2) It introduces a novel public dataset on hate speech in Spanish consisting of 6000 expert-labeled tweets. (3) It compares several classification approaches based on different document representation strategies and text classification models. (4) The best approach consists of a combination of a LTSM+MLP neural network that takes as input the tweet’s word, emoji, and expression tokens’ embeddings enriched by the tf-idf, and obtains an area under the curve (AUC) of 0.828 on our dataset, outperforming previous methods presented in the literature.",261200311,200,91,,SUTD - Roy Lee Task 1 Part 1
10.1016/j.ipm.2019.102087,Vulnerable community identification using hate speech detection on social media,"Zewdie Mossie, Jenq-Haur Wang",Information Processing and Management,2020,(missing abstract),217073072,167,49,,SUTD - Roy Lee Task 1 Part 1
10.1145/3377323,A Multilingual Evaluation for Online Hate Speech Detection,"Michele Corazza, Stefano Menini, Elena Cabrio, Sara Tonelli, S. Villata",ACM Trans. Internet Techn.,2020,"The increasing popularity of social media platforms such as Twitter and Facebook has led to a rise in the presence of hate and aggressive speech on these platforms. Despite the number of approaches recently proposed in the Natural Language Processing research area for detecting these forms of abusive language, the issue of identifying hate speech at scale is still an unsolved problem. In this article, we propose a robust neural architecture that is shown to perform in a satisfactory way across different languages; namely, English, Italian, and German. We address an extensive analysis of the obtained experimental results over the three languages to gain a better understanding of the contribution of the different components employed in the system, both from the architecture point of view (i.e., Long Short Term Memory, Gated Recurrent Unit, and bidirectional Long Short Term Memory) and from the feature selection point of view (i.e., ngrams, social network–specific features, emotion lexica, emojis, word embeddings). To address such in-depth analysis, we use three freely available datasets for hate speech detection on social media in English, Italian, and German.",73679899,158,70,,"SUTD - Roy Lee Task 1 Part 2, SUTD - Roy Lee Task 1 Part 3"
10.1007/s00607-019-00745-0,Automatic hate speech detection using killer natural language processing optimizing ensemble deep learning approach,"Zafer Al-makhadmeh, A. Tolba",Computing,2020,"Over the last decade, the increased use of social media has led to an increase in hateful activities in social networks. Hate speech is one of the most dangerous of these activities, so users have to protect themselves from these activities from YouTube, Facebook, Twitter etc. This paper introduces a method for using a hybrid of natural language processing and with machine learning technique to predict hate speech from social media websites. After hate speech is collected, steaming, token splitting, character removal and inflection elimination is performed before performing hate speech recognition process. After that collected data is examined using a killer natural language processing optimization ensemble deep learning approach (KNLPEDNN). This method detects hate speech on social media websites using an effective learning process that classifies the text into neutral, offensive and hate language. The performance of the system is then evaluated using overall accuracy, f-score, precision and recall metrics. The system attained minimum deviations mean square error − 0.019, Cross Entropy Loss − 0.015 and Logarithmic loss L-0.0238 and 98.71% accuracy.",56932236,121,48,,SUTD - Roy Lee Task 1 Part 1
10.1109/access.2021.3089515,Advances in Machine Learning Algorithms for Hate Speech Detection in Social Media: A Review,"Nanlir Sallau Mullah, Wan Mohd Nazmee Wan Zainon",IEEE Access,2021,"The aim of this paper is to review machine learning (ML) algorithms and techniques for hate speech detection in social media (SM). Hate speech problem is normally model as a text classification task. In this study, we examined the basic baseline components of hate speech classification using ML algorithms. There are five basic baseline components – data collection and exploration, feature extraction, dimensionality reduction, classifier selection and training, and model evaluation, were reviewed. There have been improvements in ML algorithms that were employed for hate speech detection over time. New datasets and different performance metrics have been proposed in the literature. To keep the researchers informed regarding these trends in the automatic detection of hate speech, it calls for a comprehensive and an updated state-of-the-art. The contributions of this study are three-fold. First to equip the readers with the necessary information on the critical steps involved in hate speech detection using ML algorithms. Secondly, the weaknesses and strengths of each method is critically evaluated to guide researchers in the algorithm choice dilemma. Lastly, some research gaps and open challenges were identified. The different variants of ML techniques were reviewed which include classical ML, ensemble approach and deep learning methods. Researchers and professionals alike will benefit immensely from this study.",151072440,118,87,,SUTD - Roy Lee Task 1 Part 1
10.1016/j.eswa.2020.113725,Detecting and visualizing hate speech in social media: A cyber Watchdog for surveillance,"Sandip Modha, Prasenjit Majumder, Thomas Mandl, Chintak Mandalia",Expert systems with applications,2020,(missing abstract),43610152,102,27,,"SUTD - Roy Lee Task 1 Part 2, SUTD - Roy Lee Task 1 Part 3"
(missing DOI),Improving Hate Speech Detection with Deep Learning Ensembles,"Steven Zimmerman, Udo Kruschwitz, C. Fox",International Conference on Language Resources and Evaluation,2018,"Hate speech has become a major issue that is currently a hot topic in the domain of social media. Simultaneously, current proposed methods to address the issue raise concerns about censorship. Broadly speaking, our research focus is the area human rights, including the development of new methods to identify and better address discrimination while protecting freedom of expression. As neural network approaches are becoming state of the art for text classification problems, an ensemble method is adapted for usage with neural networks and is presented to better classify hate speech. Our method utilizes a publicly available embedding model, which is tested against a hate speech corpus from Twitter. To confirm robustness of our results, we additionally test against a popular sentiment dataset. Given our goal, we are pleased that our method has a nearly 5 point improvement in F-measure when compared to original work on a publicly available hate speech evaluation dataset. We also note difficulties encountered with reproducibility of deep learning methods and comparison of findings from other work. Based on our experience, more details are needed in published work reliant on deep learning methods, with additional evaluation information a consideration too. This information is provided to foster discussion within the research community for future work.",276314529,102,5,,SUTD - Roy Lee Task 1 Part 1
10.1613/jair.1.12590,Confronting Abusive Language Online: A Survey from the Ethical and Human Rights Perspective,"Svetlana Kiritchenko, Isar Nejadgholi, Kathleen C. Fraser",Journal of Artificial Intelligence Research,2021,"The pervasiveness of abusive content on the internet can lead to severe psychological and physical harm. Significant effort in Natural Language Processing (NLP) research has been devoted to addressing this problem through abusive content detection and related sub-areas, such as the detection of hate speech, toxicity, cyberbullying, etc. Although current technologies achieve high classification performance in research studies, it has been observed that the real-life application of this technology can cause unintended harms, such as the silencing of under-represented groups. We review a large body of NLP research on automatic abuse detection with a new focus on ethical challenges, organized around eight established ethical principles: privacy, accountability, safety and security, transparency and explainability, fairness and non-discrimination, human control of technology, professional responsibility, and promotion of human values. In many cases, these principles relate not only to situational ethical codes, which may be context-dependent, but are in fact connected to universal human rights, such as the right to privacy, freedom from discrimination, and freedom of expression. We highlight the need to examine the broad social impacts of this technology, and to bring ethical and human rights considerations to every stage of the application life-cycle, from task formulation and dataset design, to model training and evaluation, to application deployment. Guided by these principles, we identify several opportunities for rights-respecting, socio-technical solutions to detect and confront online abuse, including ‘nudging’, ‘quarantining’, value sensitive design, counter-narratives, style transfer, and AI-driven public education applications.evaluation, to application deployment. Guided by these principles, we identify several opportunities for rights-respecting, socio-technical solutions to detect and confront online abuse, including 'nudging', 'quarantining', value sensitive design, counter-narratives, style transfer, and AI-driven public education applications.",261177854,97,110,,SUTD - Roy Lee Task 1 Part 1
(missing DOI),Tackling Online Abuse: A Survey of Automated Abuse Detection Methods,"Pushkar Mishra, Helen Yannakoudakis, Ekaterina Shutova",arXiv: Computation and Language,2019,"Abuse on the Internet represents an important societal problem of our time. Millions of Internet users face harassment, racism, personal attacks, and other types of abuse on online platforms. The psychological effects of such abuse on individuals can be profound and lasting. Consequently, over the past few years, there has been a substantial research effort towards automated abuse detection in the field of natural language processing (NLP). In this paper, we present a comprehensive survey of the methods that have been proposed to date, thus providing a platform for further development of this area. We describe the existing datasets and review the computational approaches to abuse detection, analyzing their strengths and limitations. We discuss the main trends that emerge, highlight the challenges that remain, outline possible solutions, and propose guidelines for ethics and explainability",261368873,86,79,,SUTD - Roy Lee Task 1 Part 1
10.1109/access.2020.2968173,Evaluating Machine Learning Techniques for Detecting Offensive and Hate Speech in South African Tweets,"O. Oriola, E. Kotzé",IEEE Access,2020,"In recent times, South Africa has been witnessing insurgence of offensive and hate speech along racial and ethnic dispositions on Twitter. Popular among the South African languages used is English. Although, machine learning has been successfully used to detect offensive and hate speech in several English contexts, the distinctiveness of South African tweets and the similarities among offensive, hate and free speeches require domain-specific English corpus and techniques to detect the offensive and hate speech. Thus, we developed an English corpus from South African tweets and evaluated different machine learning techniques to detect offensive and hate speech. Character n-gram, word n-gram, negative sentiment, syntactic-based features and their hybrid were extracted and analyzed using hyper-parameter optimization, ensemble and multi-tier meta-learning models of support vector machine, logistic regression, random forest, gradient boosting algorithms. The results showed that optimized support vector machine with character n-gram performed best in detection of hate speech with true positive rate of 0.894, while optimized gradient boosting with word n-gram performed best in detection of hate speech with true positive rate of 0.867. However, their performances in detection of other threatening classes were poor. Multi-tier meta-learning models achieved the most consistent and balanced classification performance with true positive rates of 0.858 and 0.887 for hate speech and offensive speech, respectively as well as true positive rate of 0.646 for free speech and overall accuracy of 0.671. The error analysis showed that multi-tier meta-learning model could reduce the misclassification error rate of the optimized models by 34.26%.",152541904,84,31,,SUTD - Roy Lee Task 1 Part 1
10.20944/preprints202011.0646.v1,Online Multilingual Hate Speech Detection: Experimenting with Hindi and English Social Media,"Neeraj Vashistha, A. Zubiaga",Inf.,2020,"The last two decades have seen an exponential increase in the use of the Internet and social media, which has changed basic human interaction. This has led to many positive outcomes. At the same time, it has brought risks and harms. The volume of harmful content online, such as hate speech, is not manageable by humans. The interest in the academic community to investigate automated means for hate speech detection has increased. In this study, we analyse six publicly available datasets by combining them into a single homogeneous dataset. Having classified them into three classes, abusive, hateful or neither, we create a baseline model and improve model performance scores using various optimisation techniques. After attaining a competitive performance score, we create a tool that identifies and scores a page with an effective metric in near-real-time and uses the same feedback to re-train our model. We prove the competitive performance of our multilingual model in two languages, English and Hindi. This leads to comparable or superior performance to most monolingual models.",145136131,84,35,,"SUTD - Roy Lee Task 1 Part 2, SUTD - Roy Lee Task 1 Part 3"
10.1109/access.2020.3009244,Deep Learning Based Fusion Approach for Hate Speech Detection,"Yanling Zhou, Yanyan Yang, Han Liu, Xiufeng Liu, N. Savage",IEEE Access,2020,"In recent years, the increasing prevalence of hate speech in social media has been considered as a serious problem worldwide. Many governments and organizations have made significant investment in hate speech detection techniques, which have also attracted the attention of the scientific community. Although plenty of literature focusing on this issue is available, it remains difficult to assess the performances of each proposed method, as each has its own advantages and disadvantages. A general way to improve the overall results of classification by fusing the various classifiers results is a meaningful attempt. We first focus on several famous machine learning methods for text classification such as Embeddings from Language Models (ELMo), Bidirectional Encoder Representation from Transformers (BERT) and Convolutional Neural Network (CNN), and apply these methods to the data sets of the SemEval 2019 Task 5. We then adopt some fusion strategies to combine the classifiers to improve the overall classification performance. The results show that the accuracy and F1-score of the classification are significantly improved.",220537045,77,27,,SUTD - Roy Lee Task 1 Part 1
10.1007/978-3-030-44289-7_24,Comparative Performance of Machine Learning and Deep Learning Algorithms for Arabic Hate Speech Detection in OSNs,"Ahmed Omar, Tarek M. Mahmoud, Tarek Abd-El-Hafeez",International Conferences on Artificial Intelligence and Computer Vision,2020,"Nowadays, Online Social Networks (OSNs) are the most popular and interactive media that used to express feelings, communicate and share information between people. However, along with useful and interesting content, sometimes unsuitable or abusive content can be published on these networks, such as hate speech and insults. Hate speech includes any type of online abuse concepts like cyberbullying, discrimination, abusive language, profanity, flaming, toxicity, and harassment. Most of the Hate speech detection attempts have concentrated on the English text, while work on the Arabic text is sparse. In this paper, we constructed a standard Arabic dataset that can be used for hate speech and abuse detection. In contrast to most previous work the datasets were collected from one platform, the proposed dataset is collected from more social network platforms (Facebook, Twitter, Instagram, and YouTube). To validate the effectiveness of the proposed datasets twelve machine learning algorithms and two deep learning architecture were used. Recurrent Neural Network (RNN) outperformed other classifiers with an accuracy of 98.7%.",46931746,76,20,,SUTD - Roy Lee Task 1 Part 1
10.1007/s00530-023-01051-8,A literature survey on multimodal and multilingual automatic hate speech identification,"Anusha Chhabra, D. Vishwakarma",Multimedia Systems,2023,(missing abstract),254682433,75,170,,"SUTD - Roy Lee Task 1 Part 2, SUTD - Roy Lee Task 1 Part 3"
10.1016/j.aej.2023.08.038,A survey on hate speech detection and sentiment analysis using machine learning and deep learning models,"Malliga Subramanian, Veerappampalayam Easwaramoorthy Sathiskumar, G. Deepalakshmi, Jaehyuk Cho, G. Manikandan",Alexandria Engineering Journal,2023,(missing abstract),265139554,71,90,,SUTD - Roy Lee Task 1 Part 1
10.3390/a15080291,Social Media Hate Speech Detection Using Explainable Artificial Intelligence (XAI),"Harshkumar Mehta, K. Passi",Algorithms,2022,"Explainable artificial intelligence (XAI) characteristics have flexible and multifaceted potential in hate speech detection by deep learning models. Interpreting and explaining decisions made by complex artificial intelligence (AI) models to understand the decision-making process of these model were the aims of this research. As a part of this research study, two datasets were taken to demonstrate hate speech detection using XAI. Data preprocessing was performed to clean data of any inconsistencies, clean the text of the tweets, tokenize and lemmatize the text, etc. Categorical variables were also simplified in order to generate a clean dataset for training purposes. Exploratory data analysis was performed on the datasets to uncover various patterns and insights. Various pre-existing models were applied to the Google Jigsaw dataset such as decision trees, k-nearest neighbors, multinomial naïve Bayes, random forest, logistic regression, and long short-term memory (LSTM), among which LSTM achieved an accuracy of 97.6%. Explainable methods such as LIME (local interpretable model—agnostic explanations) were applied to the HateXplain dataset. Variants of BERT (bidirectional encoder representations from transformers) model such as BERT + ANN (artificial neural network) with an accuracy of 93.55% and BERT + MLP (multilayer perceptron) with an accuracy of 93.67% were created to achieve a good performance in terms of explainability using the ERASER (evaluating rationales and simple English reasoning) benchmark.",244001420,67,39,,SUTD - Roy Lee Task 1 Part 1
10.1007/s41060-024-00650-6,Deep learning for hate speech detection: a comparative study,"Jitendra Singh Malik, Hezhe Qiao, Guansong Pang, Anton van den Hengel",International Journal of Data Science and Analytics,2024,"Automated hate speech detection is an important tool in combating the spread of hate speech, particularly in social media. Numerous methods have been developed for the task, including a recent proliferation of deep-learning based approaches. A variety of datasets have also been developed, exemplifying various manifestations of the hate-speech detection problem. We present here a largescale empirical comparison of deep and shallow hate-speech detection methods, mediated through the three most commonly used datasets. Our goal is to illuminate progress in the area, and identify strengths and weaknesses in the current state-of-the-art. We particularly focus our analysis on measures of practical performance, including detection accuracy, computational efficiency, capability in using pre-trained models, and domain generalization. In doing so we aim to provide guidance as to the use of hate-speech detection in practice, quantify the state-of-the-art, and identify future research directions.",279883083,63,86,,SUTD - Roy Lee Task 1 Part 1
10.48550/arxiv.2202.09517,Deep Learning for Hate Speech Detection: A Comparative Study,"Malik, Jitendra Singh, Pang, Guansong, Hengel, Anton van den",International Journal of Data Science and Analysis,2022,"Automated hate speech detection is an important tool in combating the spread of hate speech, particularly in social media. Numerous methods have been developed for the task, including a recent proliferation of deep-learning based approaches. A variety of datasets have also been developed, exemplifying various manifestations of the hate-speech detection problem. We present here a largescale empirical comparison of deep and shallow hate-speech detection methods, mediated through the three most commonly used datasets. Our goal is to illuminate progress in the area, and identify strengths and weaknesses in the current state-of-the-art. We particularly focus our analysis on measures of practical performance, including detection accuracy, computational efficiency, capability in using pre-trained models, and domain generalization. In doing so we aim to provide guidance as to the use of hate-speech detection in practice, quantify the state-of-the-art, and identify future research directions.",253725605,61,73,,SUTD - Roy Lee Task 1 Part 1
10.1002/wics.1648,"Hate speech detection in social media: Techniques, recent trends, and future challenges","Anchal Rawat, Santosh Kumar, Surender Singh Samant",WIREs Computational Statistics,2024,"The realm of Natural Language Processing and Text Mining has seen a surge in interest from researchers in hate speech detection, leading to an increase in related studies. This analysis aims to create a valuable resource by summarizing the methods and strategies used to combat hate speech in social media. We perform a detailed review to achieve a deep knowledge of the hate speech detection landscape from 2018 to 2023, revealing global incidents of hate speech in 2022–2023. Sixty‐six relevant articles were selected for this review. Existing studies were analyzed and categorized into five method categories: Machine Learning, Deep Learning, Ensemble models, Graph Neural Networks, and Graph Convolutional Networks. These advancements can aid social networking services in identifying hate messages before being posted, reducing the risk of harassment. The review also covers available hate speech datasets and highlights research challenges, but it is clear that a definitive solution to this problem is yet to be found. Future research directions are recommended to address the ongoing challenges in Hate Speech Detection.",270523600,52,127,,SUTD - Roy Lee Task 1 Part 1
