DOI,Title,Authors,Journal,Year,Abstract,LitmapsId,Cited By,References,PubMedId,Tags
10.1109/access.2025.3532397,Hate Speech Detection using Large Language Models: A Comprehensive Review,"Aish Albladi, Minarul Islam, Amit Das, Maryam Bigonah, Zheng Zhang, Fatemeh Jamshidi, Mostafa Rahgouy, Nilanjana Raychawdhary, Daniela Marghitu, Cheryl Seals",IEEE Access,2025,(missing abstract),283381865,15,0,,SUTD - Roy Lee Task 1 Part 1
10.1007/s13278-024-01361-3,A comprehensive review on automatic hate speech detection in the age of the transformer,"Gil Ramos, Fernando Batista, Ricardo Ribeiro, Pedro Fialho, Sérgio Moro, António Fonseca, Rita Guerra, Paula Carvalho, Catarina Marques, Cláudia Silva",Social Network Analysis and Mining,2024,"The rapid proliferation of hate speech on social media poses significant challenges to maintaining a safe and inclusive digital environment. This paper presents a comprehensive review of automatic hate speech detection methods, with a particular focus on the evolution of approaches from traditional machine learning and deep learning models to the more advanced Transformer-based architectures. We systematically analyze over 100 studies, comparing the effectiveness, computational requirements, and applicability of various techniques, including Support Vector Machines, Long Short-Term Memory networks, Convolutional Neural Networks, and Transformer models like BERT and its multilingual variants. The review also explores the datasets, languages, and sources used for hate speech detection, noting the predominance of English-focused research while highlighting emerging efforts in low-resource languages and cross-lingual detection using multilingual Transformers. Additionally, we discuss the role of generative and multi-task learning models as promising avenues for future development. While Transformer-based models consistently achieve state-of-the-art performance, this review underscores the trade-offs between performance and computational cost, emphasizing the need for context-specific solutions. Key challenges such as algorithmic bias, data scarcity, and the need for more standardized benchmarks are also identified. This review provides crucial insights for advancing the field of hate speech detection and shaping future research directions.",279160818,14,122,,SUTD - Roy Lee Task 1 Part 2
10.1007/s43681-023-00281-w,Merging public health and automated approaches to address online hate speech,Tina Nguyen,AI and Ethics,2023,"The COVID-19 pandemic sparked a rise in misinformation from various media sources, which contributed to the heightened severity of hate speech. The upsurgence of hate speech online has devastatingly translated to real-life hate crimes, which saw an increase of 32% in 2020 in the United States alone (U.S. Department of Justice 2022). In this paper, I explore the current effects of hate speech and why hate speech should be widely recognized as a public health issue. I also discuss current artificial intelligence (AI) and machine learning (ML) strategies to mitigate hate speech along with the ethical concerns with using these technologies. Future considerations to improve AI/ML are also examined. Through analyzing these two contrasting methodologies (public health versus AI/ML), I argue that these two approaches applied by themselves are not efficient or sustainable. Therefore, I propose a third approach that combines both AI/ML and public health. With this proposed approach, the reactive side of AI/ML and the preventative nature of public health measures are united to develop an effective manner of addressing hate speech.",258069066,14,65,,SUTD - Roy Lee Task 1 Part 1
10.30935/ojcmt/13603,A comparative analysis of machine learning algorithms for hate speech detection in social media,"Esraa Omran, Estabraq Al Tararwah, Jamal Al Qundus",Online Journal of Communication and Media Technologies,2023,"A detecting and mitigating hate speech in social media, particularly on platforms like Twitter, is a crucial task with significant societal impact. This research study presents a comprehensive comparative analysis of machine learning algorithms for hate speech detection, with the primary goal of identifying an optimal algorithmic combination that is simple, easy to implement, efficient, and yields high detection performance. Through meticulous pre-processing and rigorous evaluation, the study explores various algorithms to determine their suitability for hate speech detection. The focus is finding a combination that balances simplicity, ease of implementation, computational efficiency, and strong performance metrics. The findings reveal that the combination of naïve Bayes and decision tree algorithms achieves a high accuracy of 0.887 and an F1-score of 0.885, demonstrating its effectiveness in hate speech detection. This research contributes to identifying a reliable algorithmic combination that meets the criteria of simplicity, ease of implementation, quick processing, and strong performance, providing valuable guidance for researchers and practitioners in hate speech detection in social media. By elucidating the strengths and limitations of various algorithmic combinations, this research enhances the understanding of hate speech detection. It paves the way for developing robust solutions, creating a safer, more inclusive digital environment.",267188180,12,14,,SUTD - Roy Lee Task 1 Part 1
10.1145/3711123,Decoding Fake News and Hate Speech: A Survey of Explainable AI Techniques,"Mikel K. Ngueajio, Saurav K. Aryal, M. Atemkeng, Gloria Washington, Danda B. Rawat",ACM Computing Surveys,2025,"This survey emphasizes the significance of Explainable AI (XAI) techniques in detecting hateful speech and misinformation/Fake news. It explores recent trends in detecting these phenomena, highlighting current research that reveals a synergistic relationship between them. Additionally, it presents recent trends in the use of XAI methods to mitigate the occurrences of hateful land Fake contents in conversations. The survey reviews state-of-the-art XAI approaches, algorithms, modeling datasets, as well as the evaluation metrics leveraged for assessing model interpretability, and thus provides a comprehensive summary table of the literature surveyed and relevant datasets. It concludes with an overview of key observations, offering insights into the prominent model explainability methods used in hate speech and misinformation detection. The research strengths, limitations are also presented, as well as perspectives and suggestions for future directions in this research domain.",283516191,11,111,,SUTD - Roy Lee Task 1 Part 1
10.48550/arxiv.2306.08804,PEACE: Cross-Platform Hate Speech Detection- A Causality-guided Framework,"Paras Sheth, Tharindu Kumarage, Raha Moraffah, Amanat Chadha, Huan Liu",ECML/PKDD,2023,"Hate speech detection refers to the task of detecting hateful content that aims at denigrating an individual or a group based on their religion, gender, sexual orientation, or other characteristics. Due to the different policies of the platforms, different groups of people express hate in different ways. Furthermore, due to the lack of labeled data in some platforms it becomes challenging to build hate speech detection models. To this end, we revisit if we can learn a generalizable hate speech detection model for the cross platform setting, where we train the model on the data from one (source) platform and generalize the model across multiple (target) platforms. Existing generalization models rely on linguistic cues or auxiliary information, making them biased towards certain tags or certain kinds of words (e.g., abusive words) on the source platform and thus not applicable to the target platforms. Inspired by social and psychological theories, we endeavor to explore if there exist inherent causal cues that can be leveraged to learn generalizable representations for detecting hate speech across these distribution shifts. To this end, we propose a causality-guided framework, PEACE, that identifies and leverages two intrinsic causal cues omnipresent in hateful content: the overall sentiment and the aggression in the text. We conduct extensive experiments across multiple platforms (representing the distribution shift) showing if causal cues can help cross-platform generalization.",262905359,11,44,,SUTD - Roy Lee Task 1 Part 1
10.48550/arxiv.2302.09618,Multilingual Content Moderation: A Case Study on Reddit,"Meng Ye, Karan Sikka, Katherine Atwell, Sabit Hassan, Ajay Divakaran, Malihe Alikhani",Conference of the European Chapter of the Association for Computational Linguistics,2023,"Content moderation is the process of flagging content based on pre-defined platform rules. There has been a growing need for AI moderators to safeguard users as well as protect the mental health of human moderators from traumatic content. While prior works have focused on identifying hateful/offensive language, they are not adequate for meeting the challenges of content moderation since 1) moderation decisions are based on violation of rules, which subsumes detection of offensive speech, and 2) such rules often differ across communities which entails an adaptive solution. We propose to study the challenges of content moderation by introducing a multilingual dataset of 1.8 Million Reddit comments spanning 56 subreddits in English, German, Spanish and French1. We perform extensive experimental analysis to highlight the underlying challenges and suggest related research problems such as cross-lingual transfer, learning under label noise (human biases), transfer of moderation models, and predicting the violated rule. Our dataset and analysis can help better prepare for the challenges and opportunities of auto moderation.",254258349,10,33,,"SUTD - Roy Lee Task 1 Part 2, SUTD - Roy Lee Task 1 Part 3"
10.13052/rp-9788770220873,"Complex Project to Develop Real Tools for Identifying and Countering Terrorism: Real-time Early Detection and Alert System for Online Terrorist Content Based on Natural Language Processing, Social Network Analysis, Artificial Intelligence and Complex Event Processing","M. Florea, Cristi Potlog, P. Pollner, D. Abel, O. Garcia, S. Bar, Syed Naqvi, Waqar Asif",(missing journal),2019,"In the last decades, the importance of social media has increased extremely with the creation of new communication channels and even changing the way people are communicating. These trends came along with the disadvantage of allowing a new scenario where messages containing valuable data about critical threats like terrorism and criminal activity are ignored, due to the sheer inability to process – much less analyze – the vast amount of available data. Terrorism has a very real and direct impact on basic human rights of victims, such as the right to life, liberty and physical integrity, often with devastating consequences. 
 
In this context, the RED-Alert project was designed to build a complete software toolkit to support LEAs in the fight against the use of social media by terrorist organizations for conducting online propaganda, fundraising, recruitment and mobilization of members, planning and coordination of actions, as well as data manipulation and misinformation. The project aims to cover a wide range of social media channels used by terrorist groups to disseminate their content which will be analysed by the RED-Alert solution to support LEAs to take coordinated action in real time but having as a primordial condition preserving the privacy of citizens.",138831995,10,0,,"SUTD - Roy Lee Task 1 Part 2, SUTD - Roy Lee Task 1 Part 3"
10.2478/jsiot-2023-0020,ML and Natural Language Processing : Cyberbullying Detection System for Safer and Culturally Adaptive Digital Communities,"Viraj Shah, Anurag Sinha, Nilesh Navalkar, Shubham Gupta, Priyanca Gonsalves, Akshit Malik",Journal of Smart Internet of Things,2023,"Abstract Cyberbullying has become a ubiquitous menace in our digitally connected society, requiring strong detection and classification systems. This study presents a multi-tiered system that reliably detects and classifies instances of cyberbullying on a variety of platforms by utilising cutting-edge machine learning and natural language processing approaches. Our algorithm, which was trained on a wide range of datasets, shows excellent accuracy in differentiating between instances of cyberbullying and non-bullying situations while taking linguistic and cultural quirks into account. Furthermore, our flexible system guarantees applicability by adjusting to changing cyberbullying patterns. By promoting safer and more inclusive digital communities, our research helps to design proactive treatments that lessen the effects of online harassment. This study introduces a robust multi-tiered system designed for the detection and classification of cyberbullying across diverse digital platforms. Leveraging state-of-the-art machine learning and natural language processing techniques, our algorithm, trained on extensive datasets, exhibits exceptional accuracy in distinguishing cyberbullying instances from non-bullying scenarios while accommodating linguistic and cultural nuances. The system’s adaptability to evolving cyberbullying patterns ensures continued efficacy. By fostering safer and more inclusive online environments, our research contributes to proactive measures and mitigates the impact of digital harassment.",268820148,8,8,,"SUTD - Roy Lee Task 1 Part 2, SUTD - Roy Lee Task 1 Part 3"
10.1016/j.heliyon.2023.e16084,A web framework for information aggregation and management of multilingual hate speech.,"Rigas Kotsakis, Lazaros Vrysis, Nikolaos Vryzas, Theodora Saridou, Maria Matsiola, Andreas Veglis, Charalampos Dimoulas",Heliyon,2023,(missing abstract),262635002,8,14,,"SUTD - Roy Lee Task 1 Part 2, SUTD - Roy Lee Task 1 Part 3"
10.1109/icsmdi57622.2023.00028,Enhancing Hate Speech Detection through Explainable AI,"Dipti Mittal, Harmeet Singh",2023 3rd International Conference on Smart Data Intelligence (ICSMDI),2023,"The potential of XAI in detecting hate speech using deep learning models is versatile and multifaceted. To better understand the decision-making process of complex AI models, this study applied XAI to the dataset and investigated the interpretability and explanation of their decisions. The data was preprocessed by cleaning, tokenizing, lemmatizing, and removing inconsistencies in tweets. Simplification of categorical variables was also performed during training. Exploratory data analysis was conducted to identify patterns and insights in the dataset. The study used a set of existing models, including LIME, SHAP, XGBoost, and KTrain, to analyze the accuracy. The KTrain model achieved the highest accuracy and lowest loss among the variants developed to increase explainability.",261922623,7,22,,SUTD - Roy Lee Task 1 Part 1
10.1109/access.2024.3444188,Hate Speech and Target Community Detection in Nastaliq Urdu Using Transfer Learning Techniques,"Muhammad Shahid Iqbal Malik, Aftab Nawaz, Mona Jamjoom",IEEE Access,2024,(missing abstract),275834360,7,0,,SUTD - Roy Lee Task 1 Part 1
10.1109/access.2024.3470901,Fine-grained multilingual Hate speech detection using Explainable AI and Transformers,"Jawaid Ahmed Siddiqui, Siti Sophiayati Yuhaniz, Ghulam Mujtaba, Safdar Ali Soomro, Zafar Ali Mahar",IEEE Access,2024,(missing abstract),278208558,7,0,,SUTD - Roy Lee Task 1 Part 1
10.1007/s13369-024-09540-2,Improving Hate Speech Classification Through Ensemble Learning and Explainable AI Techniques,"Priya Garg, Meenakshi Sharma, Parteek Kumar",Arabian Journal for Science and Engineering,2024,(missing abstract),279960418,6,52,,SUTD - Roy Lee Task 1 Part 1
10.1145/3240431.3240437,"A Data Viz Platform as a Support to Study, Analyze and Understand the Hate Speech Phenomenon","A. Capozzi, V. Patti, G. Ruffo, C. Bosco",Proceedings of the 2nd International Conference on Web Studies,2018,"In this paper we present a data visualization platform designed to support the Natural Language Processing (NLP) scholar to study and analyze different corpora collected with the purpose to understand the hate speech phenomenon in social media. The project started with the creation of a corpus which collects tweets addressed to specific groups of ethnic minorities considered very controversial in the Italian public debate. Each tweet has been manually tagged with a series of attributes in order to capture the different features used to characterize the hate speech phenomenon. This corpus is mainly built to be used for training an automatic classifier and helping us in its testing and validation, before being it adopted to detect tweets targeted as hate speech on larger scale datasets. As opposed as many other traditional machine learning tasks, to build a good classifier achieving high scores in terms of accuracy is very challenging in such scenario, because of the intrinsic ambiguity of the language, the lack of a proper and explicable context in social media, and the attitude of on line users of being sarcastic and ironical. Therefore, in order to properly validate an effective feature selection process, correlations between selected attributes must be studied and analyzed. This motivated us to build an interactive platform to explore data in our corpora across the dimensions that have been used to characterize collected tweets. In our paper, after a brief introduction of the hate speech dataset, we will show how the dashboard can fit into the NLP pipeline, and how its architecture can be structured. Finally, we will present some of the challenges we have faced to visualize data with spatial, temporal and numerical attributes.",184140010,5,19,,"SUTD - Roy Lee Task 1 Part 2, SUTD - Roy Lee Task 1 Part 3"
10.1109/ntms.2019.8763830,Privacy-Preserving Social Media Forensic Analysis for Preventive Policing of Online Activities,"Syed Naqvi, Sean Enderby, Ian Williams, Waqar Asif, M. Rajarajan, Cristi Potlog, M. Florea","2019 10th IFIP International Conference on New Technologies, Mobility and Security (NTMS)",2019,"Social media is extensively used nowadays and is gaining popularity among the users with the increasing growth in the network capacity, connectivity, and speed. Moreover, affordable prices of data plans, especially mobile data packages, have considerably increased the use of multimedia by different users. This includes terrorists who use social media platforms to promote their ideology and intimidate their adversaries. It is therefore very important to develop automated solutions to semantically analyse given multimedia contents to assist law enforcement agencies in the preventive policing of online activities. A major challenge for the social media forensic analysis is to preserve the privacy of citizens who use online social networking platforms. This paper presents results of European H2020 project RED-Alert that aims to enable secure and privacy preserving data processing; hence the malicious content and the corresponding personality can be tracked while the privacy of innocent citizens can be preserved. We have mined seven social media channels for content and providing support for ten languages for analysis. Our proposed solution is designed to ensure security and policing of online contents by detecting terrorist material. We have used speech recognition, face and object detection besides audio event detection to extract information from multimedia files. We have applied anonymization techniques to ensure the privacy of citizens using social media. We have discussed the challenges and prospects of this work especially the need of using digital forensic techniques while respecting European and national data protection laws notably GDPR.",110527616,5,3,,"SUTD - Roy Lee Task 1 Part 2, SUTD - Roy Lee Task 1 Part 3"
10.1002/widm.70029,A Literature Review of Textual Cyber Abuse Detection Using Cutting-Edge Natural Language Processing Techniques: Language Models and Large Language Models,"J. A. Diaz-Garcia, Joao Paulo Carvalho",WIREs Data Mining and Knowledge Discovery,2025,"The success of social media platforms has facilitated the emergence of various forms of online abuse within digital communities. This abuse manifests in multiple ways, including hate speech, cyberbullying, emotional abuse, grooming, and shame sexting or sextortion. In this paper, we present a comprehensive analysis of the different forms of abuse prevalent in social media, with a particular focus on how emerging technologies, such as Language Models (LMs) and Large Language Models (LLMs), are reshaping both the detection and generation of abusive content within these networks. We delve into the mechanisms through which social media abuse is perpetuated, exploring the psychological and social impact. To achieve this, we conducted a literature review based on PRISMA methodology, deriving key insights in the field of cyber abuse detection. Additionally, we examine the dual role of advanced language models—highlighting their potential to enhance automated detection systems for abusive behavior while also acknowledging their capacity to generate harmful content. This paper contributes to the ongoing discourse on online safety and ethics by offering both theoretical and practical insights into the evolving landscape of cyber abuse, as well as the technological innovations that simultaneously mitigate and exacerbate it. The findings support platform administrators and policymakers in developing more effective moderation strategies, conducting comprehensive risk assessments, and integrating AI responsibly to create safer digital environments.This article is categorized under:

Algorithmic Development > Web Mining
Technologies > Classification
",288271789,4,203,,SUTD - Roy Lee Task 1 Part 1
(missing DOI),Hate Speech Detection using LIME guided Ensemble Method and DistilBERT,"N. Deepakindresh, Rohan Avireddy, Aakash Ambalavanan, B. Selvamani",FIRE,2021,"Hate Speech classification has crucial applications in the social media domain. We describe the performance of our classifiers in the Hate Speech and Offensive Content Identification Track (HASOC) of FIRE 2021 conference. The dataset provided is for Indo-European Languages. We chose English tweets and developed two main classifiers as part of HASOC Track 1, which had two Subtasks 1A and 1B. Subtask 1A is a binary Hate Speech identification task, and Subtask 1B is multi grained classification of hate, profane, offensive and neutral content. Our team ”Beware Haters” studied Support Vector Machine, Random Forest, Logistic Regression, Bidirectional Long Short Term Memory Model and an Ensemble of the listed models for the Subtask 1A and the highest Macro F1 score we achieved was 0.7722 by our Ensemble model which combined the advantages of SVM, Logistic Regression and Random Forest. We used a model interpretation tool LIME, before integrating the models in a weighted Ensemble approach. For Subtask 1B, we obtained better results using a DistilBERT model that achieved a Macro F1 score of 0.6311. We have compared the performance of the basic DistilBERT Model with a fine tuned version.",243782459,4,14,,SUTD - Roy Lee Task 1 Part 1
10.54501/jots.v2i1.150,Toward Better Automated Content Moderation in Low-Resource Languages,"Gabriel Nicholas, Aliya Bhatia",Journal of Online Trust and Safety,2023,"Social media companies have learned the hard way that poor moderation of content in languages other than English can have grave consequences. Leaving harmful content up, particularly in regions where social media platforms are primary news and communication channels, has fueled conspiracy theories, violence, and even genocide around the world (Fink 2018; Iyengar 2018). American social media companies have long faced criticism for underinvesting in regions outside the US and Europe. In response, Meta, Google, and others have begun to deploy newmultilingual language models that they claim can effectively detect and take action on harmful content in dozens if not hundreds of languages (Jigsaw 2021; Meta AI 2021b).",265194241,4,23,,"SUTD - Roy Lee Task 1 Part 2, SUTD - Roy Lee Task 1 Part 3"
(missing DOI),Large-Scale Hate Speech Detection with Cross-Domain Transfer,"Toraman, Cagri, Şahinuç, Furkan, Yılmaz, Eyup Halit",(missing journal),2022,"The performance of hate speech detection models relies on the datasets on which the models are trained. Existing datasets are mostly prepared with a limited number of instances or hate domains that define hate topics. This hinders large-scale analysis and transfer learning with respect to hate domains. In this study, we construct large-scale tweet datasets for hate speech detection in English and a low-resource language, Turkish, consisting of human-labeled 100k tweets per each. Our datasets are designed to have equal number of tweets distributed over five domains. The experimental results supported by statistical tests show that Transformer-based language models outperform conventional bag-of-words and neural models by at least 5% in English and 10% in Turkish for large-scale hate speech detection. The performance is also scalable to different training sizes, such that 98% of performance in English, and 97% in Turkish, are recovered when 20% of training instances are used. We further examine the generalization ability of cross-domain transfer among hate domains. We show that 96% of the performance of a target domain in average is recovered by other domains for English, and 92% for Turkish. Gender and religion are more successful to generalize to other domains, while sports fail most.",83202852,3,0,,SUTD - Roy Lee Task 1 Part 1
